{"$schema":"https://json-schema.org/draft/2020-12/schema","type":"object","additionalProperties":false,"required":["schema_version","candidate_descriptor_sha256","promotion_descriptor_sha256","independent_review_descriptor_sha256","selected_ids","output_root","tree_sha256","manifest_sha256","counts","status","run_files","run_hashes","aerial_boundary_verified","secret_scan_passed","rights_boundary"],"properties":{"schema_version":{"const":"verified_multimodal_real_pilot_source_acquisition_descriptor_v1.1.0"},"candidate_descriptor_sha256":{"const":"7c3729108057b374f2a108d0e3f556abcbec402d071b89268269c71340f9b96f"},"promotion_descriptor_sha256":{"const":"8fe075ab8770891662b3b78045ea77d179455af893fdef5f68a28b4e6f2f075a"},"independent_review_descriptor_sha256":{"const":"e614092da109c9fc90802dafae1b62741669aa748323bb43b98c2ad6235513e7"},"selected_ids":{"const":[0,10,100,101,102,105,8132,8134,8139,8143,10145,11118]},"output_root":{"const":"docs/dataset-factory/fixtures/real-pilot-source-acquisition-v1"},"tree_sha256":{"$ref":"#/$defs/hash"},"manifest_sha256":{"$ref":"#/$defs/hash"},"counts":{"type":"object","additionalProperties":false,"required":["files","bytes","expected_sources","captured_sources","image_samples","selected_ground_rows","unresolved","rejected","historical_verified_claims"],"properties":{"files":{"const":23},"bytes":{"const":311798},"expected_sources":{"const":17},"captured_sources":{"const":17},"image_samples":{"const":12},"selected_ground_rows":{"const":6},"unresolved":{"const":0},"rejected":{"const":0},"historical_verified_claims":{"const":0}}},"status":{"const":"verified_source_acquisition_snapshot"},"run_files":{"type":"object","additionalProperties":{"type":"string"},"minProperties":7,"maxProperties":7},"run_hashes":{"type":"object","additionalProperties":{"$ref":"#/$defs/hash"},"minProperties":7,"maxProperties":7},"aerial_boundary_verified":{"const":true},"secret_scan_passed":{"const":true},"rights_boundary":{"type":"object","additionalProperties":false,"required":["verified","license","attribution_required","attribution","limitation"],"properties":{"verified":{"const":true},"license":{"const":"CC BY 4.0"},"attribution_required":{"const":true},"attribution":{"const":"Ville de Montreal"},"limitation":{"type":"string","minLength":1}}}},"$defs":{"hash":{"type":"string","pattern":"^[a-f0-9]{64}$"}}}
